<?xml version="1.0" encoding="UTF-8"?>
<fixture xmlns:xsi="http://www.w3.org/2001/XMLSchema-instance" xsi:noNamespaceSchemaLocation="fixture.xsd"
         id="Chinese Moving Spot" type="LED">
    <channel name="PanCoarse" dmx="1" />
    <channel name="PanFine" dmx="2" />
    <channel name="TiltCoarse" dmx="3" />
    <channel name="TiltFine" dmx="4" />
    <channel name="MoveSpeed" dmx="5" />
    <channel name="Strobe" dmx="6" min="134" max="224" />
    <channel name="Master" dmx="6" min="225" />
    <channel name="Red" dmx="7" />
    <channel name="Green" dmx="8" />
    <channel name="Blue" dmx="9" />
    <channel name="Color Macros" dmx="10" />
    <channel name="ColorSpeed" dmx="11" />
    <channel name="Movement Macros" dmx="12" />
    <channel name="Gobo" dmx="13" />
    
    <movement type="Pan" min="-270" max="270"/>
    <movement type="Tilt" min="-135" max="135"/>
</fixture>
