<?xml version="1.0" encoding="utf-8"?>
<fixture
  xmlns:xsi="http://www.w3.org/2001/XMLSchema-instance"
  xmlns="fixture"
  xsi:schemaLocation="fixture fixture.xsd"
  xmlns:solver="solver"
  id="FadeCandy (program mode)" type="LED">

  <channel name="Red" dmx="1" min="0" max="255"/>
  <channel name="Green" dmx="2" min="0" max="255"/>
  <channel name="Blue" dmx="3" min="0" max="255"/>
  <channel name="Strobe" dmx="4" min="0" max="255"/>
  <channel name="Apeshit" dmx="5" min="0" max="255"/>
  <channel name="Chase" dmx="6" min="0" max="255"/>
  <channel name="Program" dmx="7" min="0" max="255"/>
</fixture>