<?xml version="1.0" encoding="UTF-8"?>
<fixture xmlns:xsi="http://www.w3.org/2001/XMLSchema-instance" xsi:noNamespaceSchemaLocation="fixture.xsd"
         id="Magic 3D Easy View Moving Head LED Beam" type="LED">
    <channel name="PanCoarse" dmx="1"/>
    <channel name="TiltCoarse" dmx="2"/>
    <channel name="Master" dmx="3"/>
    <channel name="Red" dmx="4"/>
    <channel name="Green" dmx="5"/>
    <channel name="Blue" dmx="6"/>
    <channel name="White" dmx="7"/>
    <channel name="Strobe" dmx="8" max="150"/>
    <channel name="Speed" dmx="9"/>
    <channel name="Color Macros" dmx="10"/>
    <channel name="Macro Speed" dmx="11"/>
    <channel name="Effect" dmx="12"/>
    <channel name="Effect Speed" dmx="13"/>
    <channel name="PanFine" dmx="14"/>
    <channel name="TiltFine" dmx="15"/>
    <channel name="Rest" dmx="16"/>

    <movement type="Pan" min="-270" max="270"/>
    <movement type="Tilt" min="-135" max="135"/>
</fixture>
